{
  "schema_version": 1,
  "id": "WEB-BEGINNER-001",
  "category": "web",
  "platform": "common",
  "level": "beginner",
  "title": "新設された研修ポータル",
  "request": "社内掲示板から新しい研修サイトへのアクセス要求です。通常Browserで開く前に調べてください。",
  "initial_information": {
    "完全なURL": "https://training.northstar.example/course/intro",
    "Link表示文字列": "新研修ポータル",
    "アクセス要求元": "署名付き社内リリース通知CHG-301"
  },
  "tools": [
    {
      "id": "url_parse",
      "name": "Python / URL分解",
      "input_hint": "URL",
      "description": "Pythonのurllib.parseでURL文字列からHostを取り出します。",
      "output": "python -c \"from urllib.parse import urlsplit; print(urlsplit('https://training.northstar.example/course/intro').hostname)\"\ntraining.northstar.example",
      "accepted_information_types": [
        "url"
      ],
      "input_bindings": [
        {
          "source": "initial_information",
          "id": "完全なURL"
        }
      ],
      "output_information": [
        {
          "id": "host",
          "label": "Host（次の調査に使用可能）",
          "value": "training.northstar.example",
          "data_type": "domain"
        }
      ],
      "platform_note": "Windows / Linux / macOS（Python 3）",
      "environments": [
        "windows",
        "linux"
      ]
    },
    {
      "id": "rdap",
      "name": "RDAP",
      "description": "登録Domainの所有者や登録日を確認します。Subdomainの開設日は対象外です。",
      "output": "RDAP response\n{\n  \"ldhName\": \"northstar.example\",\n  \"events\": [{\"eventAction\": \"registration\", \"eventDate\": \"2026-09-01T00:00:00Z\"}],\n  \"status\": [\"active\"]\n}",
      "accepted_information_types": [
        "domain"
      ],
      "input_bindings": [
        {
          "source": "official_domain",
          "id": "registered_domain"
        }
      ],
      "input_hint": "登録Domain",
      "platform_note": "OS共通（RDAP対応クライアント / Webサービス）",
      "environments": [
        "windows",
        "linux"
      ]
    },
    {
      "id": "resolve_dnsname",
      "name": "Resolve-DnsName [Windows]",
      "platform_note": "Windows（DnsClientモジュールのPowerShellコマンド）",
      "description": "PowerShellでDNSを照会し、名前解決の結果を確認します。",
      "output": "PS> Resolve-DnsName training.northstar.example -Type A\nName                       Type TTL Section IPAddress\ntraining.northstar.example  A    300 Answer  192.0.2.90",
      "accepted_information_types": [
        "domain"
      ],
      "input_bindings": [
        {
          "source": "url_parse",
          "id": "host"
        }
      ],
      "input_hint": "Host / Domain",
      "environments": [
        "windows"
      ]
    },
    {
      "id": "nslookup",
      "name": "nslookup",
      "platform_note": "Windows / Linux",
      "description": "DNS Serverへ名前解決を問い合わせます。",
      "output": "C:\\> nslookup training.northstar.example\nServer:  dns.northstar.example\nAddress: 192.0.2.53\n\nName:    training.northstar.example\nAddress: 192.0.2.90",
      "accepted_information_types": [
        "domain"
      ],
      "input_bindings": [
        {
          "source": "url_parse",
          "id": "host"
        }
      ],
      "input_hint": "Host / Domain",
      "environments": [
        "windows",
        "linux"
      ],
      "output_by_environment": {
        "windows": "C:\\> nslookup training.northstar.example\nServer:  dns.northstar.example\nAddress: 192.0.2.53\n\nName:    training.northstar.example\nAddress: 192.0.2.90",
        "linux": "$ nslookup training.northstar.example\nServer:\t\t192.0.2.53\nAddress:\t192.0.2.53#53\n\nName:\ttraining.northstar.example\nAddress: 192.0.2.90"
      }
    },
    {
      "id": "dig",
      "name": "dig [Linux]",
      "platform_note": "Linux / macOS（出力はLinux）",
      "description": "Linux等で使うDNS照会です。Answerを承認済みDNS台帳と比較します。",
      "output": "$ dig training.northstar.example A +noall +answer\ntraining.northstar.example. 300 IN A 192.0.2.90",
      "accepted_information_types": [
        "domain"
      ],
      "input_bindings": [
        {
          "source": "url_parse",
          "id": "host"
        }
      ],
      "input_hint": "Host / Domain",
      "environments": [
        "linux"
      ]
    }
  ],
  "references": [
    {
      "id": "official_domain",
      "name": "Official Domain",
      "content": {
        "所有": "Northstar研修部門",
        "承認Host": "training.northstar.example",
        "用途": "研修教材",
        "導入通知": "CHG-301で2026-09-15から運用",
        "登録Domain": "northstar.example"
      },
      "output_information": [
        {
          "id": "registered_domain",
          "label": "台帳の登録Domain",
          "value": "northstar.example",
          "data_type": "domain"
        }
      ]
    },
    {
      "id": "dns_snapshot",
      "name": "承認済みDNS台帳",
      "content": "training.northstar.example → 192.0.2.90。独立した社内管理台帳から取得。"
    }
  ],
  "external_references": [],
  "ground_truth": "allow",
  "explanation": "DNSの解決先とHost・用途が独立した社内台帳および導入通知に一致するため許可します。",
  "topic": "Domainの新しさと正規性を区別する",
  "summary": "新しい正規研修Domainを承認記録と照合する。",
  "learning_objectives": [
    "Domainの新しさと正規性を区別する",
    "WindowsとLinuxのDNS Toolの違いを知る"
  ],
  "required_evidence": [
    "dns_lookup",
    "official_domain",
    "dns_snapshot"
  ],
  "decision_context": "before_access",
  "scenario_type": "standard",
  "sources": [],
  "fixture_note": "組織・対象・値は架空。",
  "initial_information_types": {
    "完全なURL": "url"
  },
  "evidence_alternatives": {
    "dns_lookup": {
      "label": "DNSの解決先",
      "any_of": [
        "resolve_dnsname",
        "nslookup",
        "dig"
      ]
    }
  }
}
