{
  "schema_version": 1,
  "id": "WEB-URL-REPUTATION",
  "category": "web",
  "platform": "common",
  "level": "beginner_external",
  "ground_truth": "block",
  "title": "完全URLに対する検出履歴",
  "request": "保留中のURLを通常Browserで開くことを許可しますか。 ALLOW / BLOCKで判断してください。",
  "initial_information": {
    "URL": "https://public-share.example/view/notice",
    "URLのHost": "public-share.example",
    "受付状態": "通常Browserでは未アクセス。Host欄はURLの構文から取得。",
    "リンクの公開範囲": "一般公開の告知。Token・User ID・非公開Pathなし。"
  },
  "initial_information_types": {
    "URL": "url",
    "URLのHost": "domain"
  },
  "tools": [],
  "references": [
    {
      "id": "disclosure",
      "name": "外部照会方針",
      "content": {
        "Indicator": "機密指定のないDomain・IPと公開配布FileのSHA-256は、承認された外部サービスへ照会可。",
        "File本体": "社外秘Fileは送信不可。公開配布物は送信可。",
        "URL": "Token・User ID・内部Host・機密Pathを含む完全URLは送信不可。一般公開が確認でき、これらを含まないURLは照会可。",
        "Email・PCAP": "本文、添付、認証情報を含むため本教材の案件では外部送信不可。",
        "今回の資料区分": "照会対象のIndicatorは機密指定なし。File本体・完全URLは上記に従う。照会対象URLは一般公開されている。"
      }
    }
  ],
  "external_references": [
    {
      "id": "url_rep",
      "name": "URL Reputation",
      "description": "外部サービスへ対象を送信し、保存済みの照会結果を表示します。",
      "output": "URL: https://public-share.example/view/notice\n2026-08-18: phishing 10/14 engines; last observed 00:00Z",
      "accepted_information_types": [
        "url"
      ],
      "input_bindings": [
        {
          "source": "initial_information",
          "id": "URL"
        }
      ],
      "input_hint": "URL",
      "submission_type": "full_url",
      "submission_value": "https://public-share.example/view/notice",
      "confidentiality_warning": "Path・Queryを含む完全URLをサービスへ送信します。",
      "correct_usage": true,
      "reason": "外部照会方針でこのIndicatorの送信が許可されています。"
    }
  ],
  "required_evidence": [
    "url_rep",
    "disclosure"
  ],
  "explanation": "公開URLの該当Pathに現行のPhishing報告があり、そのURLへのアクセスを遮断します。Domain全体の評判だけでは個別Pathを評価できない場合があります。",
  "topic": "機密情報のない完全URLを照会する",
  "summary": "機密情報のない完全URLを照会する",
  "learning_objectives": [
    "機密情報のない完全URLを照会する"
  ],
  "decision_context": "before_access",
  "scenario_type": "standard",
  "sources": [
    "https://docs.virustotal.com/reference/url-info"
  ],
  "fixture_note": "組織・Domain・IP・Package・Hash・記録は架空の保存済み教材。IPは文書用アドレスで、RDAP・外部評判も実照会ではない。時刻は2026-08-18を基準とし、出力は必要なフィールドの抜粋。攻撃コマンドのPayloadは<TRAINING-PLACEHOLDER>に置換。 各問題は独立した端末・案件のSnapshot。PID・時刻の再利用は問題間の関連を意味しない。時刻はZ表記以外すべてJST。"
}
