{
  "schema_version": 1,
  "id": "EMAIL-ADVANCED-001",
  "category": "email",
  "platform": "common",
  "level": "advanced",
  "title": "取引先の正規Mailboxからの振込先変更",
  "request": "受信保留中のEmailです。取引先の正規Addressですが、依頼を受け入れてよいか判断してください。",
  "initial_information": {
    "Display Name": "North Supplies 経理",
    "From": "billing@supplier.example",
    "Subject": "Re: 9月請求書 / 口座変更",
    "本文": "今月分は新口座へ送金してください。担当者は電話に出られないため、このEmailだけで処理してください。",
    "添付File名": [],
    "URL": [],
    "Email": "held-email-advanced-001.eml"
  },
  "tools": [
    {
      "id": "raw_header",
      "name": "Raw Header",
      "description": "正規Domainからの送信かを確認します。Mailboxの利用者や業務依頼の正当性までは保証しません。 入力は受信保留中のEmail全体です。FromのAddress単独からHeaderは取得できません。",
      "output": "From: North Supplies 経理 <billing@supplier.example>\nReply-To: billing@supplier.example\nReturn-Path: <billing@supplier.example>\nReceived: from mail.supplier.example (198.51.100.60)\n by mx.northstar.example with ESMTPS; 15 Sep 2026 08:40:00 +0900\nAuthentication-Results: mx.northstar.example;\n spf=pass smtp.mailfrom=supplier.example;\n dkim=pass header.d=supplier.example;\n dmarc=pass header.from=supplier.example",
      "accepted_information_types": [
        "email"
      ],
      "input_bindings": [
        {
          "source": "initial_information",
          "id": "Email"
        }
      ],
      "input_hint": "Email全体",
      "platform_note": "OS共通の調査方法。単独の製品名ではありません。EmailクライアントやGatewayで元のHeaderを表示する操作は製品によって異なります。",
      "environments": [
        "windows",
        "linux"
      ]
    }
  ],
  "references": [
    {
      "id": "vendor_directory",
      "name": "取引先Directory",
      "content": "billing@supplier.exampleは正規の取引先Address。口座変更は登録済み連絡先への別経路確認が必要。"
    },
    {
      "id": "independent_check",
      "name": "別経路の確認記録",
      "content": "09:00、既存契約台帳の連絡先へ照会。担当者は『口座変更を依頼していない』と回答し、このEmailの依頼を否認。"
    }
  ],
  "external_references": [],
  "ground_truth": "block",
  "explanation": "認証はPassしていますが、既存の連絡先への別経路確認で取引先が依頼を否認しているため遮断します。正規Mailboxの悪用では、送信Domainの認証だけでは不正な業務依頼を見分けられません。",
  "topic": "正規Mailboxからの不正な依頼を別経路で検証する",
  "summary": "認証PassのBECを業務手続きと独立確認から判断する。",
  "learning_objectives": [
    "正規Mailboxからの不正な依頼を別経路で検証する"
  ],
  "required_evidence": [
    "raw_header",
    "vendor_directory",
    "independent_check"
  ],
  "decision_context": "before_delivery",
  "scenario_type": "real_world_inspired",
  "sources": [
    "https://www.microsoft.com/en-us/security/blog/2022/07/12/from-cookie-theft-to-bec-attackers-use-aitm-phishing-sites-as-entry-point-to-further-financial-fraud/"
  ],
  "fixture_note": "架空の組織・対象・値による教材用の抜粋。実機の実行結果ではありません。",
  "inspired_by": "Business Email Compromise（正規Mailboxを使う不正送金誘導）",
  "initial_information_types": {
    "Email": "email",
    "From": "email_address"
  }
}
