{
  "schema_version": 1,
  "id": "AUTH-WIN-ADVANCED-001",
  "category": "account",
  "platform": "windows",
  "level": "advanced",
  "title": "交換したばかりのWindows端末",
  "request": "今回のSessionはまだ成立していません。新端末という特徴に加えて、事前の登録記録を確認してください。",
  "initial_information": {
    "Username": "mei",
    "Source IP": "192.0.2.101",
    "Time": "2026-09-15T09:00:00+09:00",
    "Authentication Result": "Password照合成功・Sessionは未成立",
    "MFA Result": "登録済みFIDO2 Security Keyで成功",
    "Device情報": "WIN-NEW-31 / MDM登録済み / 準拠"
  },
  "tools": [
    {
      "id": "event_viewer",
      "name": "Event Viewer",
      "description": "今回より前のWindows Login履歴を確認します。新しい要求の成立後のLogは判断に使いません。",
      "output": "View filter: TargetUserName = mei\nWindows Security Log / past events only\nTimeCreated          Id    TargetUserName WorkstationName IpAddress\n2026-09-14 08:58:00  4624  mei            WIN-OLD-12      192.0.2.101\nLogonType: 3\n今回09:00のSession成功Logはまだ存在しません。",
      "accepted_information_types": [
        "username"
      ],
      "input_bindings": [
        {
          "source": "initial_information",
          "id": "Username"
        }
      ],
      "input_hint": "Username",
      "platform_note": "Windows標準（Event Viewer）",
      "environments": [
        "windows"
      ]
    }
  ],
  "references": [
    {
      "id": "device_record",
      "name": "Device登録 / 交換申請",
      "content": "CHG-501: meiの端末をWIN-OLD-12からWIN-NEW-31へ交換。08:30にMDM登録・準拠状態・本人受領を確認。"
    },
    {
      "id": "login_history",
      "name": "過去Login / Approved VPN",
      "content": "192.0.2.101は会社VPN出口。過去Loginの利用時間・出口と一致。"
    },
    {
      "id": "authentication_policy",
      "name": "認証方針",
      "content": "登録済み準拠端末、会社VPN、登録済みFIDO2での認証を満たす場合にSessionを許可。"
    }
  ],
  "external_references": [],
  "ground_truth": "allow",
  "explanation": "新端末でも交換申請とMDM登録が確認でき、会社VPNと登録済みFIDO2認証の条件を満たすため許可します。",
  "topic": "正常な新端末Loginを事前記録から確認する",
  "summary": "端末交換による初回Loginを登録・MFA・接続元で検証する。",
  "learning_objectives": [
    "正常な新端末Loginを事前記録から確認する"
  ],
  "required_evidence": [
    "event_viewer",
    "device_record",
    "login_history",
    "authentication_policy"
  ],
  "decision_context": "before_session",
  "scenario_type": "standard",
  "sources": [
    "https://learn.microsoft.com/en-us/previous-versions/windows/it-pro/windows-10/security/threat-protection/auditing/event-4625"
  ],
  "fixture_note": "組織・対象・値は架空。",
  "initial_information_types": {
    "Username": "username",
    "Source IP": "ip"
  }
}
