{
  "schema_version": 1,
  "id": "WEB-ADVANCED-001",
  "category": "web",
  "platform": "common",
  "level": "advanced",
  "title": "申請したPassword再設定URL",
  "request": "本人が社内ポータルで直前に申請した再設定通知です。アクセス可否と、外部照会に送ってよい情報を判断してください。",
  "initial_information": {
    "完全なURL": "https://accounts.northstar.example/reset?token=TRAINING-SECRET-ONLY",
    "Link表示文字列": "Passwordを再設定する",
    "アクセス要求元": "本人の申請REQ-908に対応する社内認証通知"
  },
  "tools": [
    {
      "id": "url_parse",
      "name": "Python / URL分解",
      "input_hint": "URL",
      "description": "Pythonのurllib.parseでURL文字列からHostを取り出します。",
      "output": "python -c \"from urllib.parse import urlsplit; print(urlsplit('https://accounts.northstar.example/reset?token=TRAINING-SECRET-ONLY').hostname)\"\naccounts.northstar.example",
      "accepted_information_types": [
        "url"
      ],
      "input_bindings": [
        {
          "source": "initial_information",
          "id": "完全なURL"
        }
      ],
      "output_information": [
        {
          "id": "host",
          "label": "Host（次の調査に使用可能）",
          "value": "accounts.northstar.example",
          "data_type": "domain"
        }
      ],
      "platform_note": "Windows / Linux / macOS（Python 3）",
      "environments": [
        "windows",
        "linux"
      ]
    }
  ],
  "references": [
    {
      "id": "official_domain",
      "name": "Official Domain",
      "content": "認証用Host: accounts.northstar.example。Password再設定は /reset?token=... の形式。通知REQ-908は本人の申請に対応し有効。"
    },
    {
      "id": "external_policy",
      "name": "外部照会方針",
      "content": "この公開Domain単位の評判検索は許可。認証Token、非公開Path、社内Fileの外部送信は禁止。Private設定でもサービス自体へ情報が渡るため禁止は解除されません。"
    }
  ],
  "external_references": [
    {
      "id": "vt_domain",
      "name": "VirusTotal / Domain検索",
      "description": "送信内容と公開範囲を確認して外部照会します。",
      "submission_type": "domain",
      "submission_value": "accounts.northstar.example",
      "output": "Domain report\nmalicious: 0\nsuspicious: 0",
      "correct_usage": true,
      "confidentiality_warning": "送信するのは公開Domainだけです。PathとQueryは送信しません。",
      "reason": "公開Domainの照会は許可されています。",
      "accepted_information_types": [
        "domain"
      ],
      "input_bindings": [
        {
          "source": "url_parse",
          "id": "host"
        }
      ],
      "input_hint": "Domain",
      "platform_note": "OS共通（VirusTotalのWeb / API）",
      "environments": [
        "windows",
        "linux"
      ]
    },
    {
      "id": "urlscan_private",
      "name": "urlscan.io / 完全URL",
      "description": "送信内容と公開範囲を確認して外部照会します。",
      "submission_type": "full_url",
      "submission_value": "https://accounts.northstar.example/reset?token=TRAINING-SECRET-ONLY",
      "output": "{\"visibility\":\"private\",\"page\":{\"domain\":\"accounts.northstar.example\"}}\nThe complete URL is disclosed to the service.",
      "correct_usage": false,
      "confidentiality_warning": "完全URLにはPassword再設定Tokenが含まれます。PrivateスキャンでもサービスへURLが渡ります。",
      "reason": "認証Tokenを含むURL全体は外部送信禁止です。公開範囲の設定だけでは情報漏洩を防げません。",
      "accepted_information_types": [
        "url"
      ],
      "input_bindings": [
        {
          "source": "initial_information",
          "id": "完全なURL"
        }
      ],
      "input_hint": "URL",
      "platform_note": "OS共通（urlscan.ioのWeb / API）",
      "environments": [
        "windows",
        "linux"
      ]
    }
  ],
  "ground_truth": "allow",
  "explanation": "本人の申請と正規Host・Pathが一致するためアクセスを許可します。Tokenを含む完全なURLは外部送信せず、必要なら許可されたDomain単位の照会に留めます。",
  "topic": "アクセス許可と外部送信の可否を判断する",
  "summary": "正規の再設定URLを許可しつつTokenの外部送信を避ける。",
  "learning_objectives": [
    "アクセス許可と外部送信の可否を判断する"
  ],
  "required_evidence": [
    "official_domain",
    "external_policy"
  ],
  "decision_context": "before_access",
  "scenario_type": "standard",
  "sources": [
    "https://docs.virustotal.com/docs/searching",
    "https://urlscan.io/docs/api/"
  ],
  "fixture_note": "組織・対象・値は架空。",
  "initial_information_types": {
    "完全なURL": "url"
  }
}
