{
  "schema_version": 1,
  "id": "PROC-LINUX-BEGINNER-001",
  "category": "process",
  "platform": "linux",
  "level": "beginner",
  "title": "backup-agent / PID 810",
  "request": "実行中のServiceです。何が起動したProcessかを調べ、継続（ALLOW）か停止（BLOCK）を判断してください。",
  "initial_information": {
    "Process名": "backup-agent",
    "PID": 810,
    "User": "backup",
    "CPU": "0.3%",
    "Memory": "24 MiB",
    "Service Unit": "backup-agent.service"
  },
  "tools": [
    {
      "id": "ps",
      "name": "ps",
      "description": "PID、親PID、User、引数を確認します。Process名と実行Pathを区別します。",
      "output": "$ ps -p 810 -o pid,ppid,user,args\n    PID    PPID USER     COMMAND\n    810       1 backup   /usr/local/bin/backup-agent --config /etc/backup-agent.conf",
      "accepted_information_types": [
        "pid"
      ],
      "input_bindings": [
        {
          "source": "initial_information",
          "id": "PID"
        }
      ],
      "input_hint": "PID",
      "platform_note": "Linux / macOS。Linuxのpsを模した出力例です。",
      "environments": [
        "linux"
      ]
    },
    {
      "id": "systemctl",
      "name": "systemctl",
      "description": "systemd Unitの起動状態と実行Processを調べます。enabledだけで安全とは判断しません。",
      "output": "$ systemctl status backup-agent.service\n● backup-agent.service - Company backup agent\n     Loaded: loaded (/etc/systemd/system/backup-agent.service; enabled)\n     Active: active (running)\n   Main PID: 810 (backup-agent)\n      Tasks: 2\n     Memory: 24.0M\n     CGroup: /system.slice/backup-agent.service\n             └─810 /usr/local/bin/backup-agent --config /etc/backup-agent.conf",
      "accepted_information_types": [
        "service"
      ],
      "input_bindings": [
        {
          "source": "initial_information",
          "id": "Service Unit"
        }
      ],
      "input_hint": "Service",
      "platform_note": "Linux",
      "environments": [
        "linux"
      ]
    }
  ],
  "references": [
    {
      "id": "approved_service",
      "name": "Approved Software",
      "content": "承認済み: backup-agent.service、User backup、/usr/local/bin/backup-agent、設定 /etc/backup-agent.conf。構成管理の導入記録CM-81に一致。"
    }
  ],
  "external_references": [],
  "ground_truth": "allow",
  "explanation": "psとsystemctlから、承認されたServiceが指定User・Path・設定で起動していると確認できるため継続を許可します。Process名だけでなく起動元と設定を確認します。",
  "topic": "psとsystemctlでServiceの起動元を確認する",
  "summary": "systemdから起動された承認済みBackup Serviceを調べる。",
  "learning_objectives": [
    "psとsystemctlでServiceの起動元を確認する"
  ],
  "required_evidence": [
    "ps",
    "systemctl",
    "approved_service"
  ],
  "decision_context": "running_process",
  "scenario_type": "standard",
  "sources": [
    "https://man7.org/linux/man-pages/man1/ps.1.html"
  ],
  "fixture_note": "架空の組織・対象・値による教材用の抜粋。実機の実行結果ではありません。",
  "initial_information_types": {
    "PID": "pid",
    "User": "username",
    "Process名": "process_name",
    "Service Unit": "service"
  }
}
