{
  "schema_version": 1,
  "id": "WEB-INTERMEDIATE-001",
  "category": "web",
  "platform": "common",
  "level": "intermediate",
  "title": "会議前のブラウザ確認",
  "request": "公開された会議案内からのリンクです。通常Browserで開く前に調べてください。",
  "initial_information": {
    "完全なURL": "https://verify-help.example/check",
    "Link表示文字列": "会議室へ入る前にブラウザを確認",
    "アクセス要求元": "公開イベントの案内ページ"
  },
  "tools": [
    {
      "id": "url_parse",
      "name": "Python / URL分解",
      "input_hint": "URL",
      "description": "Pythonのurllib.parseでURL文字列からHostを取り出します。",
      "output": "python -c \"from urllib.parse import urlsplit; print(urlsplit('https://verify-help.example/check').hostname)\"\nverify-help.example",
      "accepted_information_types": [
        "url"
      ],
      "input_bindings": [
        {
          "source": "initial_information",
          "id": "完全なURL"
        }
      ],
      "output_information": [
        {
          "id": "host",
          "label": "Host（次の調査に使用可能）",
          "value": "verify-help.example",
          "data_type": "domain"
        }
      ],
      "platform_note": "Windows / Linux / macOS（Python 3）",
      "environments": [
        "windows",
        "linux"
      ]
    },
    {
      "id": "rdap",
      "name": "RDAP",
      "description": "Domainの登録情報を調べます。",
      "output": "RDAP response\n{\"ldhName\":\"verify-help.example\",\"events\":[{\"eventAction\":\"registration\",\"eventDate\":\"2026-09-13T00:00:00Z\"}]}",
      "accepted_information_types": [
        "domain"
      ],
      "input_bindings": [
        {
          "source": "url_parse",
          "id": "host"
        }
      ],
      "input_hint": "Host / Domain",
      "platform_note": "OS共通（RDAP対応クライアント / Webサービス）",
      "environments": [
        "windows",
        "linux"
      ]
    }
  ],
  "references": [
    {
      "id": "meeting_policy",
      "name": "会議サービスの手引き",
      "content": "正規会議Hostはmeet.northstar.exampleです。参加時にOSの実行ダイアログ、Terminal、PowerShellへCommandを貼り付ける手順はありません。"
    },
    {
      "id": "isolated_report",
      "name": "組織内の隔離調査レポート",
      "content": "本URLを組織内の隔離環境で調査済み。ページは人間確認と称し、Win+Rを押してClipboardのCommandを実行するよう要求。Clipboardの内容は <TRAINING-COMMAND-OMITTED> に置換。"
    }
  ],
  "external_references": [
    {
      "id": "urlscan",
      "name": "urlscan.io / 公開URL",
      "description": "送信内容と公開範囲を確認して外部照会します。",
      "submission_type": "full_url",
      "submission_value": "https://verify-help.example/check",
      "output": "{\"page\":{\"domain\":\"verify-help.example\"},\"verdicts\":{\"overall\":{\"malicious\":false}}}\nCAPTCHA asks user to run a command.",
      "correct_usage": true,
      "confidentiality_warning": "URL全体をサービスに送信します。このURLは公開済みで機密値を含まず、組織方針上の照会対象です。",
      "reason": "公開URLの照会は許可されています。判定ではページの要求内容を正規手順と照合します。",
      "accepted_information_types": [
        "url"
      ],
      "input_bindings": [
        {
          "source": "initial_information",
          "id": "完全なURL"
        }
      ],
      "input_hint": "URL",
      "platform_note": "OS共通（urlscan.ioのWeb / API）",
      "environments": [
        "windows",
        "linux"
      ]
    }
  ],
  "ground_truth": "block",
  "explanation": "会議参加の確認にOSでのCommand実行を要求し、正規サービスの手順にも一致しないため遮断します。",
  "topic": "Webページの要求操作を正規手順と比較する",
  "summary": "Fake CAPTCHAによるCommand実行誘導を隔離調査結果から判断する。",
  "learning_objectives": [
    "Webページの要求操作を正規手順と比較する"
  ],
  "required_evidence": [
    "meeting_policy",
    "isolated_report"
  ],
  "decision_context": "before_access",
  "scenario_type": "real_world_inspired",
  "sources": [
    "https://www.microsoft.com/en-us/security/blog/2025/08/21/think-before-you-clickfix-analyzing-the-clickfix-social-engineering-technique/",
    "https://urlscan.io/docs/api/"
  ],
  "fixture_note": "組織・対象・値は架空。",
  "inspired_by": "ClickFix / Fake CAPTCHA",
  "initial_information_types": {
    "完全なURL": "url"
  }
}
